{
  "schema_version": "1.0",
  "id": "missy.patch-test-repair.v1",
  "version": "1.0.0",
  "description": "Repair a deliberately introduced arithmetic regression in an isolated reviewed fixture using a constrained patch and declarative test oracle.",
  "repository": {
    "repository_id": "MissyLabs/missy",
    "commit_sha": "cd378928b8609cf48f83cc75393a18086bb2c7a1",
    "snapshot_id": "missy-cd378928b8609cf48f83cc75393a18086bb2c7a1"
  },
  "task": {
    "class": "patch-generation",
    "prompt_uri": "workloads/missy/patch-test-repair/prompt.md",
    "prompt_sha256": "8eb884754cdafae4f2fb87c808a521367f63e2b811660bf6ed6fab287a1121e5",
    "fixture_digests": {
      "repair.py": "41a8a0d852e720cd3b6451fdfa52a86623d0e8f296742e40d2b345ac7de3db8e",
      "test_cases.json": "54a1725b15ef7ba647471a579569f23e741d6feb8a293c45e668ef2afcfb6cb1",
      "oracle.json": "39a5c14945be4085f5d422d4026c15dd17257098001e77290c5c94ae30613c1f"
    }
  },
  "providers": [],
  "sandbox": {
    "image_digest": "registry.invalid/repoeval/missy-offline@sha256:0000000000000000000000000000000000000000000000000000000000000000",
    "cpu_mhz": 500,
    "memory_mb": 512,
    "disk_mb": 1024,
    "network_policy": "offline"
  },
  "execution": {"warmups": 0, "repetitions": 1, "parallelism": 1, "timeout_seconds": 120, "max_attempts": 1, "seed": 1003},
  "validation": {
    "evaluator_version": "missy-oracle/1",
    "validators": [{"id": "missy.patch-oracle", "version": "1", "required": true, "parameters": {"source": "fixtures/repair.py", "tests": "fixtures/test_cases.json", "oracle": "fixtures/oracle.json"}}]
  },
  "artifacts": {"output_prefix": "missy/patch-test-repair", "retention_class": "benchmark-short", "required_kinds": ["patch", "validator-report"]}
}
