{
  "schema_version": "1.0",
  "id": "repository-orientation",
  "version": "1.0.0",
  "description": "Identify architecture, entry points, tests, and ownership from a pinned snapshot.",
  "repository": {
    "repository_id": "github:example/project",
    "commit_sha": "0123456789abcdef0123456789abcdef01234567",
    "snapshot_id": "snapshot-example-001"
  },
  "task": {
    "class": "repository-orientation",
    "prompt_uri": "artifact://workloads/repository-orientation/prompt.md",
    "prompt_sha256": "aaaaaaaaaaaaaaaaaaaaaaaaaaaaaaaaaaaaaaaaaaaaaaaaaaaaaaaaaaaaaaaa",
    "fixture_digests": {}
  },
  "providers": [
    {"registry_key": "provider-a", "model": "model-a", "settings": {"temperature": 0}},
    {"registry_key": "provider-b", "model": "model-b", "settings": {"temperature": 0}}
  ],
  "sandbox": {
    "image_digest": "registry.example.invalid/repoeval/runner@sha256:bbbbbbbbbbbbbbbbbbbbbbbbbbbbbbbbbbbbbbbbbbbbbbbbbbbbbbbbbbbbbbbb",
    "cpu_mhz": 2000,
    "memory_mb": 4096,
    "disk_mb": 8192,
    "network_policy": "forge-provider-artifacts-v1",
    "architecture": "amd64"
  },
  "execution": {
    "warmups": 0,
    "repetitions": 3,
    "parallelism": 2,
    "timeout_seconds": 1800,
    "max_attempts": 2,
    "seed": 1
  },
  "validation": {
    "evaluator_version": "orientation-v1",
    "validators": [
      {"id": "orientation-facts", "version": "1.0.0", "required": true, "parameters": {}}
    ]
  },
  "artifacts": {
    "output_prefix": "artifact://repoeval/example/",
    "retention_class": "development",
    "required_kinds": ["normalized-response", "validator-report"]
  }
}
